{
  "$id": "https://w3id.org/traceability/schemas/MechanicalProperty.json",
  "$schema": "https://json-schema.org/draft-07/schema#",
  "$comment": "{\"term\": \"MechanicalProperty\", \"@id\": \"https://w3id.org/traceability#MechanicalProperty\"}",
  "title": "Mechanical Property",
  "description": "A property, used to indicate attributes and relationships of some Thing; equivalent to rdf:Property.",
  "type": "object",
  "properties": {
    "@context": {
      "type": "array"
    },
    "type": {
      "oneOf": [
          { "type": "string" },
          { "type": "array"}
      ]
  },
    "identifier": {
      "$comment": "{\"term\": \"identifier\", \"@id\": \"https://schema.org/identifier\"}",
      "title": "Property Identifier",
      "description": "Identifiers for a property.",
      "type": "string"
    },
    "name": {
      "$comment": "{\"term\": \"name\", \"@id\": \"https://schema.org/name\"}",
      "title": "Property Name",
      "description": "The name of the item.",
      "type": "string"
    },
    "description": {
      "$comment": "{\"term\": \"description\", \"@id\": \"https://schema.org/description\"}",
      "title": "Property Description",
      "description": "The description of the item.",
      "type": "string"
    }
  },
  "additionalProperties": false,
  "examples": []
}
